{
  "treeId": "ml-engineer-masters",
  "title": "ML Engineer (Master's Program)",
  "category": "Machine Learning",
  "difficulty": "hard",
  "description": "Path to becoming an ML Engineer alongside a 4-semester master's program: engineering foundations, data, classic ML, LLM systems, MLOps and the math behind it. Each skill has a checklist of topics to tick off.",
  "version": "1.1",
  "estimatedMonths": 24,
  "totalNodes": 47,
  "icon": "neurology",
  "nodes": [
    {
      "id": "terminal",
      "label": "Терминал",
      "description": "Уверенно работать в командной строке: навигация, запуск команд, чтение ошибок.",
      "icon": "terminal",
      "zone": "Foundation",
      "resources": [],
      "requires": [],
      "checklist": [
        {
          "id": "nav",
          "label": "Навигация: cd, ls, pwd, абсолютные и относительные пути"
        },
        {
          "id": "files",
          "label": "Файлы и папки: cp, mv, rm, mkdir, cat, less"
        },
        {
          "id": "pipes",
          "label": "Потоки и пайпы: |, >, >>, grep, head, tail"
        },
        {
          "id": "env",
          "label": "Переменные окружения и PATH"
        },
        {
          "id": "errors",
          "label": "Чтение ошибок и кодов возврата, --help и man"
        }
      ]
    },
    {
      "id": "git",
      "label": "Git и GitHub",
      "description": "Вести историю изменений и работать в команде через ветки и pull request.",
      "icon": "fork_right",
      "zone": "Foundation",
      "resources": [],
      "requires": [
        "terminal"
      ],
      "checklist": [
        {
          "id": "basics",
          "label": "init / clone / add / commit / status / log / diff"
        },
        {
          "id": "gitignore",
          "label": ".gitignore: не коммитить секреты, данные и окружения"
        },
        {
          "id": "branches",
          "label": "Ветки: создание, переключение, merge"
        },
        {
          "id": "conflicts",
          "label": "Разрешение конфликтов слияния"
        },
        {
          "id": "remote",
          "label": "Работа с remote: push, pull, fetch"
        },
        {
          "id": "pr",
          "label": "Pull request: описание, code review, правки по замечаниям"
        },
        {
          "id": "undo",
          "label": "Откат изменений: restore, revert, reset"
        }
      ]
    },
    {
      "id": "linux",
      "label": "Linux и деплой на сервер",
      "description": "Администрировать сервер и разворачивать на нём сервисы.",
      "icon": "computer",
      "zone": "Foundation",
      "resources": [],
      "requires": [
        "terminal"
      ],
      "checklist": [
        {
          "id": "perms",
          "label": "Пользователи, права доступа, chmod/chown, sudo"
        },
        {
          "id": "procs",
          "label": "Процессы: ps, top/htop, kill, сигналы"
        },
        {
          "id": "packages",
          "label": "Пакетный менеджер (apt)"
        },
        {
          "id": "ssh",
          "label": "SSH: ключи, config, подключение к серверу"
        },
        {
          "id": "scp",
          "label": "Копирование файлов на сервер: scp / rsync"
        },
        {
          "id": "systemd",
          "label": "Сервисы systemd: unit-файл, автозапуск, journalctl"
        },
        {
          "id": "vps",
          "label": "Деплой сервиса на VPS: окружение, секреты, обновление"
        }
      ]
    },
    {
      "id": "networks-api",
      "label": "Сети, HTTP и API",
      "description": "Понимать, как сервисы общаются по сети, и уметь работать с внешними API.",
      "icon": "api",
      "zone": "Foundation",
      "resources": [],
      "requires": [
        "terminal"
      ],
      "checklist": [
        {
          "id": "ports",
          "label": "IP, DNS, порты, localhost"
        },
        {
          "id": "http",
          "label": "HTTP: методы, статус-коды, заголовки, тело запроса"
        },
        {
          "id": "rest",
          "label": "REST и JSON"
        },
        {
          "id": "curl",
          "label": "Запросы из терминала (curl) и из Python (httpx / requests)"
        },
        {
          "id": "auth",
          "label": "Аутентификация: API-ключи, токены, хранение секретов в .env"
        },
        {
          "id": "limits",
          "label": "Rate limits, таймауты, повторы"
        }
      ]
    },
    {
      "id": "python-envs",
      "label": "Окружения и зависимости (uv)",
      "description": "Изолировать окружения проекта и воспроизводимо фиксировать зависимости.",
      "icon": "deployed_code",
      "zone": "Python Core",
      "resources": [],
      "requires": [
        "terminal"
      ],
      "checklist": [
        {
          "id": "venv",
          "label": "Виртуальные окружения: зачем и как устроены"
        },
        {
          "id": "uv",
          "label": "uv: создание проекта, uv add / uv sync / uv run"
        },
        {
          "id": "pyproject",
          "label": "pyproject.toml: зависимости, группы dev-зависимостей"
        },
        {
          "id": "lock",
          "label": "Lock-файл и воспроизводимая установка"
        },
        {
          "id": "python-versions",
          "label": "Управление версиями Python"
        }
      ]
    },
    {
      "id": "python-programming",
      "label": "Базовый Python",
      "description": "Синтаксис, структуры данных, функции и ООП. Дисциплина 1 семестра.",
      "icon": "code",
      "zone": "Python Core",
      "resources": [],
      "requires": [
        "python-envs"
      ],
      "checklist": [
        {
          "id": "types",
          "label": "Типы данных: int, float, str, bool, None"
        },
        {
          "id": "collections",
          "label": "Коллекции: list, tuple, dict, set"
        },
        {
          "id": "conditions",
          "label": "Условия и логические операторы"
        },
        {
          "id": "loops",
          "label": "Циклы: for, while, break/continue, range, enumerate, zip"
        },
        {
          "id": "comprehensions",
          "label": "Comprehensions и генераторы"
        },
        {
          "id": "functions",
          "label": "Функции: аргументы, *args/**kwargs, области видимости, lambda"
        },
        {
          "id": "exceptions",
          "label": "Исключения: try/except/finally, свои исключения"
        },
        {
          "id": "files",
          "label": "Работа с файлами и контекстные менеджеры"
        },
        {
          "id": "oop",
          "label": "ООП: классы, наследование, магические методы, dataclasses"
        },
        {
          "id": "stdlib",
          "label": "Стандартная библиотека: pathlib, json, datetime, collections, itertools"
        }
      ]
    },
    {
      "id": "python-production",
      "label": "Python для продакшена",
      "description": "Писать код, который можно поддерживать: структура проекта, модули, типизация, конфиги.",
      "icon": "construction",
      "zone": "Python Core",
      "resources": [],
      "requires": [
        "python-programming",
        "git"
      ],
      "checklist": [
        {
          "id": "structure",
          "label": "Структура проекта: src-layout, пакеты, точка входа"
        },
        {
          "id": "modules",
          "label": "Модули и импорты, разбиение кода на слои"
        },
        {
          "id": "typing",
          "label": "Аннотации типов и проверка mypy / pyright"
        },
        {
          "id": "pydantic",
          "label": "Валидация данных с pydantic"
        },
        {
          "id": "config",
          "label": "Конфиги: переменные окружения, .env, pydantic-settings"
        },
        {
          "id": "logging",
          "label": "Логирование вместо print"
        },
        {
          "id": "lint",
          "label": "Линтер и форматтер (ruff), pre-commit"
        }
      ]
    },
    {
      "id": "testing",
      "label": "Тесты (pytest)",
      "description": "Покрывать код автоматическими тестами и запускать их одной командой.",
      "icon": "bug_report",
      "zone": "Python Core",
      "resources": [],
      "requires": [
        "python-production"
      ],
      "checklist": [
        {
          "id": "basics",
          "label": "pytest: тестовые функции, assert, запуск"
        },
        {
          "id": "fixtures",
          "label": "Фикстуры и conftest.py"
        },
        {
          "id": "parametrize",
          "label": "Параметризация тестов"
        },
        {
          "id": "mocks",
          "label": "Моки внешних сервисов и API"
        },
        {
          "id": "db",
          "label": "Тесты с базой данных"
        },
        {
          "id": "coverage",
          "label": "Покрытие кода (pytest-cov)"
        }
      ]
    },
    {
      "id": "python-async",
      "label": "Асинхронность",
      "description": "Понимать async-код на уровне, достаточном для ботов и API. Глубоко не обязательно.",
      "icon": "sync",
      "zone": "Python Core",
      "resources": [],
      "requires": [
        "python-programming"
      ],
      "checklist": [
        {
          "id": "event-loop",
          "label": "Event loop, async/await, корутины"
        },
        {
          "id": "gather",
          "label": "Параллельные задачи: asyncio.gather, таймауты"
        },
        {
          "id": "blocking",
          "label": "Почему нельзя блокировать event loop"
        },
        {
          "id": "aiogram",
          "label": "Async на практике: aiogram, httpx.AsyncClient"
        }
      ]
    },
    {
      "id": "docker",
      "label": "Docker и docker-compose",
      "description": "Упаковывать сервисы в контейнеры и поднимать несколько сервисов вместе.",
      "icon": "inventory_2",
      "zone": "Tools",
      "resources": [],
      "requires": [
        "linux",
        "networks-api",
        "python-envs"
      ],